[
  {
    "id": "S001",
    "title": "Age of the Earth",
    "creator": "U.S. Geological Survey",
    "url": "https://pubs.usgs.gov/gip/geotime/age.html",
    "source_kind": "institutional_science_explanation",
    "inspection": "relevant_passage",
    "inspected_locator": "Earth-age estimate paragraph",
    "inspection_note": "Use the 4.54-billion-year estimate only. Other oldest-rock and cosmological rankings on this older page have not been adopted.",
    "publication_year": null,
    "doi": null,
    "alternative_urls": [],
    "accessed": "2026-10-11",
    "rights": "Not cleared for redistribution; link and original summary only.",
    "local_copy": null,
    "sha256": null,
    "human_review": "pending"
  },
  {
    "id": "S002",
    "title": "Geochronology of the khondalite belt of Trivandrum Block, Southern India: Electron probe ages and implications for Gondwana tectonics",
    "creator": "M. Santosh; T. Morimoto; Y. Tsutsumi",
    "url": "https://www.sciencedirect.com/science/article/pii/S1342937X05000237",
    "source_kind": "research_article",
    "inspection": "abstract_and_preview",
    "inspected_locator": "Gondwana Research 9(3), 261–278; author abstract mirrored in EPA HERO",
    "inspection_note": "Abstract and publisher preview read 2026-10-18; full text paywalled and not obtained. EPA HERO mirror timed out. Has an erratum, S003. Numerical findings remain correction-pending and are recorded only in notes/evidence-review.",
    "publication_year": 2006,
    "doi": "10.1016/j.gr.2005.11.003",
    "alternative_urls": [
      "https://hero.epa.gov/reference/517944/",
      "https://gbank.gsj.jp/geolis/geolis_link/200621733/en"
    ],
    "accessed": "2026-10-18",
    "rights": "Not cleared for redistribution; link and original summary only.",
    "local_copy": null,
    "sha256": null,
    "human_review": "pending"
  },
  {
    "id": "S003",
    "title": "Erratum to the Trivandrum Block geochronology paper",
    "creator": "M. Santosh; T. Morimoto; Y. Tsutsumi",
    "url": "https://doi.org/10.1016/j.gr.2006.04.002",
    "source_kind": "erratum",
    "inspection": "metadata_only",
    "inspected_locator": "Gondwana Research 10(1–2), 203–204 (August 2006)",
    "inspection_note": "Existence and bibliographic identity checked; correction text not obtained. Do not infer what the erratum changes.",
    "publication_year": 2006,
    "doi": "10.1016/j.gr.2006.04.002",
    "alternative_urls": [
      "https://www.researchgate.net/publication/240439316_Erratum_to_Geochronology_of_the_Khondalite_Belt_of_Trivandrum_Block_Southern_India_Electron_Probe_Ages_and_Implications_for_Gondwana_Tectonics_Gondwana_Research_Volume_9_2006_261-278"
    ],
    "accessed": "2026-10-18",
    "rights": "Not cleared for redistribution; link and original summary only.",
    "local_copy": null,
    "sha256": null,
    "human_review": "pending"
  },
  {
    "id": "S004",
    "title": "Tectono-magmatic evolution of the west coast of India",
    "creator": "K. R. Subrahmanya",
    "url": "https://www.sciencedirect.com/science/article/pii/S1342937X05708479",
    "source_kind": "research_article",
    "inspection": "abstract_only",
    "inspected_locator": "Publisher title and abstract",
    "inspection_note": "Regional rifting, magmatism and margin evolution; not a single birthday for the present coastline.",
    "publication_year": 1998,
    "doi": "10.1016/S1342-937X(05)70847-9",
    "alternative_urls": [],
    "accessed": "2026-10-11",
    "rights": "Not cleared for redistribution; link and original summary only.",
    "local_copy": null,
    "sha256": null,
    "human_review": "pending"
  },
  {
    "id": "S005",
    "title": "Sedimentation record in the Konkan–Kerala Basin: implications for the evolution of the Western Ghats and the Western Indian passive margin",
    "creator": "D. Campanile; C. G. Nambiar; P. Bishop; M. Widdowson; R. Brown",
    "url": "https://onlinelibrary.wiley.com/doi/10.1111/j.1365-2117.2007.00341.x",
    "source_kind": "research_article",
    "inspection": "abstract_and_metadata",
    "inspected_locator": "Basin Research 20, 3–22; abstract",
    "inspection_note": "Publication year is 2008, despite 2007 in the DOI. Basin records inform erosion and margin evolution; full article not critically reviewed.",
    "publication_year": 2008,
    "doi": "10.1111/j.1365-2117.2007.00341.x",
    "alternative_urls": [],
    "accessed": "2026-10-11",
    "rights": "Not cleared for redistribution; link and original summary only.",
    "local_copy": null,
    "sha256": null,
    "human_review": "pending"
  },
  {
    "id": "S006",
    "title": "Oldest rocks from Peninsular India: Evidence for Hadean to Neoarchean crustal evolution",
    "creator": "M. Santosh; Qiong-Yan Yang; E. Shaji; M. Ram Mohan; T. Tsunogae; M. Satyanarayanan",
    "url": "https://www.sciencedirect.com/science/article/pii/S1342937X14003268",
    "source_kind": "research_article",
    "inspection": "abstract_and_catalogue",
    "inspected_locator": "Gondwana Research 29(1), 105–135; Geological Survey of Japan catalogue",
    "inspection_note": "An important lead, not a verified oldest-rock ranking. Sample context and whether ages are measured, inherited or model ages require full-text review.",
    "publication_year": 2016,
    "doi": "10.1016/j.gr.2014.11.003",
    "alternative_urls": [
      "https://gbank.gsj.jp/geolis/geolis_link/201600802/en"
    ],
    "accessed": "2026-10-11",
    "rights": "Not cleared for redistribution; link and original summary only.",
    "local_copy": null,
    "sha256": null,
    "human_review": "pending"
  },
  {
    "id": "S007",
    "title": "Sr isotope numerical depositional age of Miocene marine strata (Quilon Formation), Kerala–Konkan Basin, India",
    "creator": "Nora Carolin; Ravikant Vadlamani; Sunil Bajpai",
    "url": "https://link.springer.com/article/10.1007/s12040-022-01898-x",
    "source_kind": "research_article",
    "inspection": "abstract_and_metadata",
    "inspected_locator": "Journal of Earth System Science 131, article 152; abstract",
    "inspection_note": "Preferred 17.08–17.13 Ma depositional estimate reported in the abstract. Full sample tables and analytical uncertainty were not inspected. Published 27 June 2022.",
    "publication_year": 2022,
    "doi": "10.1007/s12040-022-01898-x",
    "alternative_urls": [],
    "accessed": "2026-10-11",
    "rights": "Not cleared for redistribution; link and original summary only.",
    "local_copy": null,
    "sha256": null,
    "human_review": "pending"
  },
  {
    "id": "S008",
    "title": "New perspectives on late Tethyan Neogene biodiversity development of fishes based on Miocene (~17 Ma) otoliths from southwestern India",
    "creator": "Nora Carolin; Sunil Bajpai; Abhayanand Singh Maurya; Werner Schwarzhans",
    "url": "https://link.springer.com/article/10.1007/s12542-022-00623-9",
    "source_kind": "research_article",
    "inspection": "abstract_and_metadata",
    "inspected_locator": "PalZ 97, 43–80; abstract and publication metadata",
    "inspection_note": "First online 31 May 2022; journal volume publication 2023. These are not fossil ages.",
    "publication_year": 2023,
    "doi": "10.1007/s12542-022-00623-9",
    "alternative_urls": [],
    "accessed": "2026-10-11",
    "rights": "Not cleared for redistribution; link and original summary only.",
    "local_copy": null,
    "sha256": null,
    "human_review": "pending"
  },
  {
    "id": "S009",
    "title": "Archaeological Discoveries of Pre- and Proto-historic Cultures from North Kerala, South India",
    "creator": "Ramesh N. K.",
    "url": "https://ndl.iitkgp.ac.in/re_document/heritage_jmsa/heritage_jmsa/20cbac6daf651e060f585ee15a7fb490",
    "source_kind": "research_article_catalogue",
    "inspection": "full_text",
    "inspected_locator": "Heritage 4 (2016), 627–636; full article PDF, finds pp. 628–631, conclusion p. 635",
    "inspection_note": "Full article read 2026-10-18. Lower Palaeolithic attribution rests on tool typology of surface finds from river terraces of the Vanimel and Chaithravahini. No excavation, stratigraphy or absolute dates are reported, and no coordinates are given. This does not establish a first-occupation calendar year. Conclusion locator rechecked in the publisher PDF text layer on 2026-10-19: printed p. 635; page-image retrieval failed.",
    "publication_year": 2016,
    "doi": null,
    "alternative_urls": [
      "https://heritageuniversityofkerala.com/VolumeDetails.aspx?VID=4",
      "https://heritageuniversityofkerala.com/JournalPDF/Volume4/39.pdf"
    ],
    "accessed": "2026-10-19",
    "rights": "Not cleared for redistribution; link and original summary only.",
    "local_copy": null,
    "sha256": null,
    "human_review": "pending"
  },
  {
    "id": "S010",
    "title": "Mesolithic Cultures of India",
    "creator": "INFLIBNET e-PG Pathshala / archaeology teaching module",
    "url": "https://ebooks.inflibnet.ac.in/icp02/chapter/mesolithic-cultures-of-india/",
    "source_kind": "teaching_overview",
    "inspection": "relevant_passages",
    "inspected_locator": "Kerala subsection; Thenmala/Tenmala and Ankode; summary",
    "inspection_note": "Useful route to Rajendran reports, not a substitute for them. The 5210-years-ago charcoal statement lacks laboratory identifier, error and calibration in this passage. Its general summary also contains an inconsistent South India generalization.",
    "publication_year": null,
    "doi": null,
    "alternative_urls": [],
    "accessed": "2026-10-11",
    "rights": "Not cleared for redistribution; link and original summary only.",
    "local_copy": null,
    "sha256": null,
    "human_review": "pending"
  },
  {
    "id": "S011",
    "title": "Edakkal Caves",
    "creator": "Wayanad District administration / tourism",
    "url": "https://wayanad.gov.in/en/tourist-place/edakkal-caves/",
    "source_kind": "tourism_claim",
    "inspection": "relevant_passage",